{
  "ir_version": "1.0",
  "compiler_version": "1.1",
  "artifact_type": "api_inventory",
  "generated_at": "2026-06-25T10:19:35Z",
  "repository_commit": "f95b4fe91f273f7a6745f2f7d1de4733757db2dd",
  "provenance": {
    "artifact_id": "ART-API-INV-00001",
    "produced_by": "Phase0_Discovery",
    "consumes": [
      "apps/smriti_retail_os"
    ],
    "used_by": [
      "docs_renderers",
      "dependency_graph"
    ]
  },
  "data": [
    {
      "artifact_id": "ART-API-00194",
      "method": "smriti_retail_os.backup_api.get_settings",
      "evidence_type": "AST",
      "source_file": "apps/smriti_retail_os/smriti_retail_os/backup_api.py",
      "arguments": [],
      "db_references": [],
      "checksum": "f2dddcff065b2a0e36ba046e9f2db92a7eb51fe304ea9e3465517efc7a0773c7"
    },
    {
      "artifact_id": "ART-API-00195",
      "method": "smriti_retail_os.backup_api.save_settings",
      "evidence_type": "AST",
      "source_file": "apps/smriti_retail_os/smriti_retail_os/backup_api.py",
      "arguments": [
        "settings"
      ],
      "db_references": [],
      "checksum": "87f3ff67187b252f94029497b3916a7cb3a822eafcb71841bb78b3f500979704"
    },
    {
      "artifact_id": "ART-API-00196",
      "method": "smriti_retail_os.backup_api.get_backup_status",
      "evidence_type": "AST",
      "source_file": "apps/smriti_retail_os/smriti_retail_os/backup_api.py",
      "arguments": [],
      "db_references": [],
      "checksum": "d1f75469b4d440bcaf72a5ee2d2a78c4fefe3ac16bbd9440f0eead4620158790"
    },
    {
      "artifact_id": "ART-API-00197",
      "method": "smriti_retail_os.backup_api.get_backup_history",
      "evidence_type": "AST",
      "source_file": "apps/smriti_retail_os/smriti_retail_os/backup_api.py",
      "arguments": [],
      "db_references": [],
      "checksum": "831e18cba3ebd3b5cf7a6c964377dbb5fb2f7063777ed95d98fe3e1b0cf9772f"
    },
    {
      "artifact_id": "ART-API-00198",
      "method": "smriti_retail_os.backup_api.export_site_config",
      "evidence_type": "AST",
      "source_file": "apps/smriti_retail_os/smriti_retail_os/backup_api.py",
      "arguments": [
        "password"
      ],
      "db_references": [],
      "checksum": "bf0d8a3921184f094cdf0bb2173183d4a2532b7dcfde927cace06a4486f8fe1b"
    },
    {
      "artifact_id": "ART-API-00199",
      "method": "smriti_retail_os.backup_api.run_smtp_password_migration",
      "evidence_type": "AST",
      "source_file": "apps/smriti_retail_os/smriti_retail_os/backup_api.py",
      "arguments": [],
      "db_references": [],
      "checksum": "02957950ff5e3224eab7553a3c70729bbb61fc2ffbaf02ca79ef8079a80a585a"
    },
    {
      "artifact_id": "ART-API-00200",
      "method": "smriti_retail_os.backup_api.verify_custodian_emails",
      "evidence_type": "AST",
      "source_file": "apps/smriti_retail_os/smriti_retail_os/backup_api.py",
      "arguments": [
        "emails"
      ],
      "db_references": [],
      "checksum": "43ebd5e13a42d7328b1b3c0521b111a0f5e9c4816f779c3a4da14e10e9fbd278"
    },
    {
      "artifact_id": "ART-API-00201",
      "method": "smriti_retail_os.backup_api.send_recovery_key",
      "evidence_type": "AST",
      "source_file": "apps/smriti_retail_os/smriti_retail_os/backup_api.py",
      "arguments": [
        "recipient_email"
      ],
      "db_references": [],
      "checksum": "9a8f801c9fb5824972d6c51aed7e631afa1ca2b6e953e86bc637547290ab0552"
    },
    {
      "artifact_id": "ART-API-00202",
      "method": "smriti_retail_os.backup_api.get_encryption_status",
      "evidence_type": "AST",
      "source_file": "apps/smriti_retail_os/smriti_retail_os/backup_api.py",
      "arguments": [],
      "db_references": [],
      "checksum": "b49a96665d540c9ca34e69d442ffc994a74a297c74ea4a924704783b245d1e83"
    },
    {
      "artifact_id": "ART-API-00203",
      "method": "smriti_retail_os.backup_api.confirm_custodian_otp",
      "evidence_type": "AST",
      "source_file": "apps/smriti_retail_os/smriti_retail_os/backup_api.py",
      "arguments": [
        "email",
        "otp"
      ],
      "db_references": [],
      "checksum": "e3b58caec52c3e9a82df9550443f5e36af0b569ebd43d9b02852e7bd2a940919"
    },
    {
      "artifact_id": "ART-API-00204",
      "method": "smriti_retail_os.backup_api.rotate_encryption_key",
      "evidence_type": "AST",
      "source_file": "apps/smriti_retail_os/smriti_retail_os/backup_api.py",
      "arguments": [
        "new_key"
      ],
      "db_references": [],
      "checksum": "c4cb7e8cca73ef8087cf7909965c98ce293951b5035ae58e0985945f62905d7e"
    },
    {
      "artifact_id": "ART-API-00205",
      "method": "smriti_retail_os.backup_api.take_backup_now",
      "evidence_type": "AST",
      "source_file": "apps/smriti_retail_os/smriti_retail_os/backup_api.py",
      "arguments": [
        "backup_type"
      ],
      "db_references": [],
      "checksum": "b36216ce3542dc22aef38249274ba5448b4099d0268e609fd21a935744c63362"
    },
    {
      "artifact_id": "ART-API-00206",
      "method": "smriti_retail_os.backup_api.delete_backup",
      "evidence_type": "AST",
      "source_file": "apps/smriti_retail_os/smriti_retail_os/backup_api.py",
      "arguments": [
        "file_name"
      ],
      "db_references": [],
      "checksum": "18735ccd95a1d77d8e792709be7ec8657b20ff08f7847d19deb80c421298592e"
    },
    {
      "artifact_id": "ART-API-00207",
      "method": "smriti_retail_os.backup_api.restore_backup",
      "evidence_type": "AST",
      "source_file": "apps/smriti_retail_os/smriti_retail_os/backup_api.py",
      "arguments": [
        "file_name"
      ],
      "db_references": [],
      "checksum": "a3c084ad909c84661a00ef3d96a952abe1730418a948b4756609d713d9facee5"
    },
    {
      "artifact_id": "ART-API-00101",
      "method": "smriti_retail_os.barcode_api.get_barcode_filters",
      "evidence_type": "AST",
      "source_file": "apps/smriti_retail_os/smriti_retail_os/barcode_api.py",
      "arguments": [],
      "db_references": [
        "Brand",
        "Department",
        "DocType",
        "Item Group",
        "SMRITI Gender",
        "SMRITI Print Template",
        "Supplier"
      ],
      "checksum": "4b28a8c2b0fcd75af10657c244ee73ce8646e9f92f5e68fb3575c5a289e21cd6"
    },
    {
      "artifact_id": "ART-API-00102",
      "method": "smriti_retail_os.barcode_api.get_print_templates",
      "evidence_type": "AST",
      "source_file": "apps/smriti_retail_os/smriti_retail_os/barcode_api.py",
      "arguments": [],
      "db_references": [
        "DocType",
        "SMRITI Print Template"
      ],
      "checksum": "4f2844d129853d4812566fadc362a19008a3f121c4319d4d41f8a3a73e642389"
    },
    {
      "artifact_id": "ART-API-00103",
      "method": "smriti_retail_os.barcode_api.expand_item_variants",
      "evidence_type": "AST",
      "source_file": "apps/smriti_retail_os/smriti_retail_os/barcode_api.py",
      "arguments": [
        "item_code",
        "default_print_qty"
      ],
      "db_references": [
        "Item"
      ],
      "checksum": "b0b8a587fbab4d046f34e133bbd51486babb85b2714e8ea68e8a58731860c45b"
    },
    {
      "artifact_id": "ART-API-00104",
      "method": "smriti_retail_os.barcode_api.get_transaction_items_checklist",
      "evidence_type": "AST",
      "source_file": "apps/smriti_retail_os/smriti_retail_os/barcode_api.py",
      "arguments": [
        "source_doctype",
        "source_name"
      ],
      "db_references": [
        "Item",
        "Item Barcode"
      ],
      "checksum": "509d99d83bfe1e95072bce84eec4f87fcb974e086cf8829236cec5aaf8e3dce5"
    },
    {
      "artifact_id": "ART-API-00105",
      "method": "smriti_retail_os.barcode_api.get_items_by_range",
      "evidence_type": "AST",
      "source_file": "apps/smriti_retail_os/smriti_retail_os/barcode_api.py",
      "arguments": [
        "from_article",
        "to_article"
      ],
      "db_references": [],
      "checksum": "7efcd1c1e31c1ce80e5faa2c4e6d19cb0517519f4dc3d26fd9a88fd5a0a3b0e3"
    },
    {
      "artifact_id": "ART-API-00106",
      "method": "smriti_retail_os.barcode_api.get_items_for_printing",
      "evidence_type": "AST",
      "source_file": "apps/smriti_retail_os/smriti_retail_os/barcode_api.py",
      "arguments": [
        "filters",
        "source_doctype",
        "source_name"
      ],
      "db_references": [
        "Item Attribute",
        "Purchase Receipt",
        "Stock Entry"
      ],
      "checksum": "b04f8d9f7777495e90ff2697136fc6fda801e194a34830a17469056fdab9392f"
    },
    {
      "artifact_id": "ART-API-00107",
      "method": "smriti_retail_os.barcode_api.generate_prn",
      "evidence_type": "AST",
      "source_file": "apps/smriti_retail_os/smriti_retail_os/barcode_api.py",
      "arguments": [
        "items",
        "template_name"
      ],
      "db_references": [
        "DocType",
        "Item",
        "SMRITI Print Template"
      ],
      "checksum": "dee84dde0c2efeb44cf1b8052715e812b0b1885caa0dc7eeff8bb251e538333d"
    },
    {
      "artifact_id": "ART-API-00108",
      "method": "smriti_retail_os.barcode_api.send_to_network_printer",
      "evidence_type": "AST",
      "source_file": "apps/smriti_retail_os/smriti_retail_os/barcode_api.py",
      "arguments": [
        "items",
        "template_name",
        "printer_ip",
        "printer_port"
      ],
      "db_references": [],
      "checksum": "06d9062d9cebc8e8ac8d0cacf537e3f3b310a7e966d2cf775582e4c14fd996f8"
    },
    {
      "artifact_id": "ART-API-00109",
      "method": "smriti_retail_os.barcode_api.get_field_mapping_reference",
      "evidence_type": "AST",
      "source_file": "apps/smriti_retail_os/smriti_retail_os/barcode_api.py",
      "arguments": [],
      "db_references": [],
      "checksum": "1d29f0ced59558c1dda728cee610114a50d86723586229d336c3fa8aa895d569"
    },
    {
      "artifact_id": "ART-API-00110",
      "method": "smriti_retail_os.barcode_api.get_recent_transactions",
      "evidence_type": "AST",